<?xml version="1.0"?>
<!DOCTYPE statedata SYSTEM "stateData.dtd">
<statedata>
	<controlData identifier="openloop" 
	             mode="PERCENT_OUTPUT"/>
				 
	<controlData identifier="closedloop"
				 mode="VELOCITY_RPS"
				 proportional="0.095"
				 integral="0.0005"
				 feedforward="0.0385"/>
	<controlData identifier="closedloop2"
				 mode="VELOCITY_RPS"
				 proportional="0.145"
				 integral="0.00075"
				 feedforward="0.0475"/>

	<mechanismTarget stateIdentifier="SHOOTER_OFF"
	                 controlDataIdentifier="openloop"
	                 controlDataIdentifier2="openloop"
					 value="0.0"
					 secondValue="0.0"/>

 	<mechanismTarget stateIdentifier="SHOOT_HIGHGOAL_CLOSE"
	                 controlDataIdentifier="closedloop2"
	                 controlDataIdentifier2="closedloop"
					 value="45.0"
					 secondValue="37"/> 

 	<mechanismTarget stateIdentifier="SHOOT_HIGHGOAL_FAR"
	                 controlDataIdentifier="closedloop2"
	                 controlDataIdentifier2="closedloop"
					 value="45.0"
					 secondValue="37"/> 

	<mechanismTarget stateIdentifier="SHOOT_LOWGOAL"
	                 controlDataIdentifier="openloop"
	                 controlDataIdentifier2="openloop"
					 value="0.3" 
					 secondValue="0.3"/> 

	<mechanismTarget stateIdentifier="MANUAL_SHOOT"
	                 controlDataIdentifier="closedloop2"
	                 controlDataIdentifier2="closedloop"
					 value="24"
					 secondValue="22"/>

	<mechanismTarget stateIdentifier="PREPARETOSHOOT"
	                 controlDataIdentifier="closedloop2"
	                 controlDataIdentifier2="closedloop"
					 value="24"
					 secondValue="22"/>


</statedata>