<?xml version="1.0"?>
<!DOCTYPE statedata SYSTEM "stateData.dtd">
<statedata>
	<controlData identifier="openloop" 
	             mode="PERCENT_OUTPUT"/>
				 
	<controlData identifier="closedloopposdegrees"
				 mode="POSITION_DEGREES"
				 proportional="0.003"/>
				 
	<controlData identifier="closedloopposinches"
				 mode="POSITION_INCH"
				 proportional="0.03"/>

	<controlData identifier="closedloopvel"
				 mode="VELOCITY_RPS"
				 proportional="0.155"
				 feedforward="0.045"/>

	<mechanismTarget stateIdentifier="OFF"
	                 controlDataIdentifier="openloop"
	                 controlDataIdentifier2="openloop"
					 value="0.0"
					 secondValue="0.0"
					 robotPitch="0.0"/>

	<mechanismTarget stateIdentifier="STARTING_CONFIG"
	                 controlDataIdentifier="closedloopposinches"
	                 controlDataIdentifier2="closedloopposdegrees"
					 value="0.0"
					 secondValue="0.0"
					 robotPitch="0.0"/>

	<mechanismTarget stateIdentifier="MANUAL"
	                 controlDataIdentifier="openloop"
	                 controlDataIdentifier2="openloop"
					 value="0.0"
					 secondValue="0.0"
					 robotPitch="0.0"/>

	<mechanismTarget stateIdentifier="PREP_MID_BAR"
	                 controlDataIdentifier="closedloopposinches"
	                 controlDataIdentifier2="closedloopposdegrees"
					 value="19.0"
					 secondValue="0.0"
					 robotPitch="0.0"/>

	<mechanismTarget stateIdentifier="CLIMB_MID_BAR"
	                 controlDataIdentifier="closedloopposinches"
	                 controlDataIdentifier2="closedloopposdegrees"
					 value="1.0"
					 secondValue="0.0"
					 robotPitch="-12.1"/>

	<mechanismTarget stateIdentifier="FRONT_HOOK_PREP_FOR_NEXT_BAR"
	                 controlDataIdentifier="closedloopposinches"
	                 controlDataIdentifier2="closedloopposdegrees"
					 value="10.0"
					 secondValue="0.0"
					 robotPitch="-12.1"/>

	<mechanismTarget stateIdentifier="FRONT_HOOK_ROTATE_A"
	                 controlDataIdentifier="closedloopposinches"
	                 controlDataIdentifier2="closedloopposdegrees"
					 value="10.0"
					 secondValue="53.0"
					 robotPitch="6.5"/>

	<mechanismTarget stateIdentifier="FRONT_HOOK_ROTATE_B"
	                 controlDataIdentifier="closedloopposinches"
	                 controlDataIdentifier2="closedloopposdegrees"
					 value="1.0"
					 secondValue="103.0"
					 robotPitch="24.1"/>

	<mechanismTarget stateIdentifier="FRONT_HOOK_ELEVATE"
	                 controlDataIdentifier="closedloopposinches"
	                 controlDataIdentifier2="closedloopposdegrees"
					 value="19.0"
					 secondValue="103.0"
					 robotPitch="24.1"/>

	<mechanismTarget stateIdentifier="FRONT_HOOK_ROTATE_TO_HOOK"
	                 controlDataIdentifier="closedloopposinches"
	                 controlDataIdentifier2="closedloopposdegrees"
					 value="19.0"
					 secondValue="80.0"
					 robotPitch="16.8"/>

	<mechanismTarget stateIdentifier="FRONT_HOOK_LIFT_ROBOT"
	                 controlDataIdentifier="closedloopposinches"
	                 controlDataIdentifier2="closedloopposdegrees"
					 value="10.0"
					 secondValue="80.0"
					 robotPitch="16.8"/>

	<mechanismTarget stateIdentifier="FRONT_HOOK_ROTATE_ARM"
	                 controlDataIdentifier="closedloopposinches"
	                 controlDataIdentifier2="closedloopposdegrees"
					 value="10.0"
					 secondValue="0.0"
					 robotPitch="-12.1"/>

	<mechanismTarget stateIdentifier="BACK_HOOK_PREP"
	                 controlDataIdentifier="closedloopposinches"
	                 controlDataIdentifier2="closedloopposdegrees"
					 value="19.0"
					 secondValue="0.0"
					 robotPitch="-12.1"/>

	<mechanismTarget stateIdentifier="BACK_HOOK_ROTATE_A"
	                 controlDataIdentifier="closedloopposinches"
	                 controlDataIdentifier2="closedloopposdegrees"
					 value="19.0"
					 secondValue="66.0"
					 robotPitch="11.6"/>

	<mechanismTarget stateIdentifier="BACK_HOOK_LIFT_ROBOT"
	                 controlDataIdentifier="closedloopposinches"
	                 controlDataIdentifier2="closedloopposdegrees"
					 value="5.0"
					 secondValue="66.0"
					 robotPitch="11.6"/>

	<mechanismTarget stateIdentifier="BACK_HOOK_REST"
	                 controlDataIdentifier="closedloopposinches"
	                 controlDataIdentifier2="closedloopposdegrees"
					 value="19.0"
					 secondValue="66.0"
					 robotPitch="11.6"/>


</statedata> 
